update_id,as_of_date,week_id,asset_id,change_type,thesis_status,summary,evidence_for,evidence_against,kill_criterion_status,next_question,author
tu-2026-w29-gev-baseline,2026-07-18,2026-W29,gev,baseline,watchlist,Power and electrification demand is strongly confirmed; valuation leaves little room for ordinary execution.,Q1 orders rose 71% organically and backlog reached $163B.,Wind is expected to lose about $400M of segment EBITDA in 2026 and the market cap is roughly $284B.,not_tested,What portion of data-centre orders is repeatable and what margins are embedded in backlog?,Investo Master
tu-2026-w29-vrt-baseline,2026-07-18,2026-W29,vrt,baseline,watchlist,Vertiv is a direct AI infrastructure beneficiary with accelerating sales and cash flow; the present valuation is demanding.,Q1 sales rose 30%; full-year organic growth guidance is 29%-31%.,"Order cancellation, capacity execution and a roughly $113B market value reduce asymmetry.",not_tested,How durable is the present book-to-bill after customer build plans normalise?,Investo Master
tu-2026-w29-crdo-baseline,2026-07-18,2026-W29,crdo,baseline,researching,"Credo has outstanding growth and attractive connectivity economics, but its revenue base is unusually concentrated.",FY2026 revenue rose to $1.335B and operating cash flow reached $464M.,Two customers represented 81% of revenue; share-based compensation was $183M.,not_tested,Which products and customers can make the growth base genuinely diversified?,Investo Master
tu-2026-w29-rklb-baseline,2026-07-18,2026-W29,rklb,baseline,researching,"Rocket Lab could become an end-to-end space platform, but the Iridium transaction changes the underwriting problem.","Q1 revenue grew 63.5%, backlog exceeded $2.2B, and Iridium adds spectrum and 2.55M subscribers.","Rocket Lab remains loss-making; the deal uses cash, stock and a $3.6B bridge facility while Neutron is unproven.",not_tested,What is the fully financed per-share return distribution after the Iridium transaction?,Investo Master
tu-2026-w29-mp-baseline,2026-07-18,2026-W29,mp,baseline,researching,"MP is a strategically scarce mine-to-magnet platform with improving production, but economics are intertwined with policy support.",NdPr production rose 63% and sales volume 117%; 10X has long-term government support.,Q1 included $42.3M of price-protection income and the company still reported a net loss.,not_tested,What returns can the magnet chain earn without the price floor and EBITDA guarantee?,Investo Master
